read,name,link
N,Community codes-of-conduct brief conversation started by @feorlen,https://posts.app.net/67264281
N,ADN Minecraft server map - by @33mhz (see @s3rv),https://s3rv.com/mc/
N,ADN brief literary conversation,https://posts.app.net/67229329
Y,Bobby's Lament by @mlv,https://github.com/mlv/stories/blob/master/BobbysLament.md
Y,Applying media theories to Social media - from 33mhz,http://start-thinking.com/sm-and-comm-theories
Y,Jekyll Liquid Data files,http://jekyllrb.com/docs/datafiles/
Y,My test blog,http://baz.bt3.com/
Y,My primary blog,http://blog.bt3.com/